{
  "id": "microval--2016lr62",
  "source": "MICROVAL",
  "source_certificate_number": "2016LR62",
  "commercial_name": "Fossomatic ™ 7",
  "manufacturer": {
    "name": "Foss Analytical A/S",
    "address_raw": null,
    "represented_in_europe": null,
    "site_of_production": null
  },
  "method_type": {
    "action": null,
    "category": "flow_cytometry"
  },
  "target_organism": {
    "normalized": "Somatic cell count",
    "raw": "Somatic cell count"
  },
  "reference_method": {
    "standard": "ISO 8196-3; ISO 13366-2; EURL MMP Criteria",
    "raw": "ISO 8196-3; ISO 13366-2; EURL MMP Criteria"
  },
  "validation_scope": {
    "raw": "Raw cow´s milk",
    "matrices": [
      "Raw cow´s milk"
    ],
    "excluded_matrices": [],
    "max_test_portion_g": null
  },
  "study_design": {
    "protocol_standard": "EN ISO 16140-2:2016",
    "study_type": "unknown",
    "number_of_labs": null,
    "number_of_samples": null,
    "expert_laboratory": "Q-lip"
  },
  "certification": {
    "original_date": "2017-10-17",
    "renewal_dates": [],
    "extension_dates": [],
    "current_expiry": "2029-10-16",
    "status": "active"
  },
  "performance": null,
  "traceability": {
    "source_document_type": "live_web_page",
    "source_document_url": "https://nen.bettywebblocks.com/view-microval",
    "summary_report_pdf_url": "https://assets.eu.bettyblocks.com/eu-central-1-2e826c3765f4401c84671a06de961fc7/e1e4b8ec2b22479080d36038777c5403/18935/2016LR62_-_Fossomatic_7_-_Summary_report.pdf",
    "extraction_date": null,
    "extraction_confidence": "high",
    "notes": "MicroVal listing page label: 'view-microval'. Raw status text: 'Valid', raw expiry text: '16-10-2029'. Study report available for further mining."
  }
}