{
  "id": "nf-validation--uni-03-10-03-15",
  "source": "NF-VALIDATION",
  "source_certificate_number": "UNI 03/10-03/15",
  "commercial_name": "Thermo Scientific™ SureTect™ Escherichia coli O157:H7 PCR Assay",
  "manufacturer": {
    "name": "Oxoid Ltd., Part of Thermo Fisher Scientific",
    "address_raw": "Company holder of the certification : OXOID Ltd Thermo Fisher Scientific Wade Road Basingstoke Hampshire RG24 8PW ENGLAND Représentée en Europe par : Represented in Europe by : Thermo Fisher Scientific Ratastie 2, 01620, Vantaa, Finland Site de production: Site of production : Thermo Fisher Scientific Oy (Microbiology Vantaa) Ratastie 2, PO BOX 100, VANTAA FI-01621, FINLAND",
    "represented_in_europe": null,
    "site_of_production": null
  },
  "method_type": {
    "action": "detection",
    "category": "molecular_pcr"
  },
  "target_organism": {
    "normalized": "E. coli O157",
    "raw": "E. coli O157"
  },
  "reference_method": {
    "standard": "NF EN ISO 16654",
    "raw": "Type de méthode : Détection des E. coli O157"
  },
  "validation_scope": {
    "raw": "VIANDES CRUES DE BŒUF (PRISE D’ESSAI DE 25G), LEGUMES ET FRUITS (PRISE D’ESSAI DE 25G) RAW BEEF MEATS (25G TEST PORTION), VEGETABLE AND FRUITS (25G TEST PORTION)",
    "matrices": [],
    "excluded_matrices": [],
    "max_test_portion_g": null
  },
  "study_design": {
    "protocol_standard": "EN ISO 16140-2:2016",
    "study_type": "unknown",
    "number_of_labs": null,
    "number_of_samples": null
  },
  "certification": {
    "original_date": "2015-03-26",
    "renewal_dates": [
      "2019-11-28",
      "2023-02-24",
      "2027-03-26"
    ],
    "extension_dates": [
      "2015-07-06",
      "2016-01-28",
      "2020-07-02"
    ],
    "current_expiry": "2027-03-26",
    "status": "active"
  },
  "performance": {
    "method_nature": "qualitative",
    "qualitative": {
      "method_comparison_by_category": [
        {
          "category": "Raw beef meat (8 h)",
          "sensitivity_alternative_pct": 90.0,
          "sensitivity_reference_pct": 96.7,
          "rlod": null
        },
        {
          "category": "Vegetables and fruits (20h)",
          "sensitivity_alternative_pct": 74.2,
          "sensitivity_reference_pct": 67.7,
          "rlod": null
        }
      ],
      "inclusivity": {},
      "exclusivity": {}
    }
  },
  "traceability": {
    "source_document_type": "live_web_page",
    "source_document_url": "https://nf-validation.afnor.org/domaine-agroalimentaire/e-coli-o157/",
    "extraction_date": null,
    "extraction_confidence": "high",
    "notes": "Mined from the summary validation report PDF. relative_trueness_by_category (quantitative) and method_comparison_by_category (qualitative) are extracted from the report's per-category results table via its structural cell grid (pdfplumber), not by matching the table header's exact wording -- confirmed necessary since real reports from different expert laboratories phrase that header differently. accuracy_profile.by_matrix names each matrix by its ISO 16140-2 food CATEGORY (e.g. 'Dairy products'), not the specific product tested (e.g. 'Milk') -- an earlier version tried the more specific product name from the accuracy-profile chart captions, but checking a rendered page image against the extracted text showed that caption sequence can be reordered relative to the SD-repeatability table sequence even on the same page (a chart is a separate drawn object from its table), which silently mispaired two matrices. Category order was checked the same way and does hold, so that's the safe anchor used instead; the extractor refuses to pair values at all (returns []) if the category count and SD-repeatability-line count disagree. samples_out_of_beta_eti is left empty for every matrix: the outside-the-limit narrative names specific products, and mapping those back to the right category isn't safely extractable, so leaving it empty beats a guessed attribution -- see the report itself for that detail. loq_log is NOT mined -- its source table's cell values did not extract as real numbers at all (came back as literal zeros), a clear sign the table structure defeats plain-text extraction; left null rather than record that placeholder. Inclusivity/exclusivity narrative parsing has only been tested against one report (TEMPO EB) and its exact wording -- other reports may need pattern adjustments.",
    "certificate_pdf_url": "https://nf-validation.afnor.org/wp-content/uploads/2025/05/UNI-03-10-03-15_fr_-002.pdf",
    "summary_report_pdf_url": "https://nf-validation.afnor.org/wp-content/uploads/2015/04/Synt-UNI-03-10-03-15_en.pdf",
    "organism_page_last_updated_raw": "6 août 2026"
  }
}