{
  "id": "nf-validation--bio-12-11-03-04",
  "source": "NF-VALIDATION",
  "source_certificate_number": "BIO 12/11-03/04",
  "commercial_name": "VIDAS® Listeria monocytogenes 2 (LMO2 – avec étape d’enrichissement à 37°C)",
  "manufacturer": {
    "name": "bioMérieux",
    "address_raw": "et site de production: Company holder of the certification and site of production: bioMérieux SA Chemin de l’Orme 69280 Marcy l’Etoile FRANCE",
    "represented_in_europe": null,
    "site_of_production": null
  },
  "method_type": {
    "action": "detection",
    "category": "immunological_elisa"
  },
  "target_organism": {
    "normalized": "Listeria monocytogenes",
    "raw": "Listeria monocytogenes"
  },
  "reference_method": {
    "standard": "NF EN ISO 11290-1; NF EN ISO 11290-2",
    "raw": "Détection des Listeria monocytogenes"
  },
  "validation_scope": {
    "raw": "*TOUS PRODUITS D’ALIMENTATION HUMAINE ET LES ECHANTILLONS DE L’ENVIRONNEMENT DE PRODUCTION INDUSTRIELLE *ALL HUMAN FOOD PRODUCTS AND INDUSTRIAL PRODUCTION ENVIRONMENTAL SAMPLES",
    "matrices": [],
    "excluded_matrices": [],
    "max_test_portion_g": null
  },
  "study_design": {
    "protocol_standard": "EN ISO 16140-2:2016",
    "study_type": "unknown",
    "number_of_labs": null,
    "number_of_samples": null,
    "expert_laboratory": "Microsept"
  },
  "certification": {
    "original_date": "2004-03-12",
    "renewal_dates": [
      "2008-01-17",
      "2012-02-02",
      "2016-06-30",
      "2020-01-30"
    ],
    "extension_dates": [
      "2004-12-02",
      "2006-12-14",
      "2011-06-30",
      "2016-01-29",
      "2018-10-04",
      "2024-03-06",
      "2022-06-16",
      "2028-03-12"
    ],
    "current_expiry": "2028-03-12",
    "status": "active"
  },
  "performance": {
    "method_nature": "qualitative",
    "qualitative": {
      "method_comparison_by_category": [
        {
          "category": "Meat products",
          "sensitivity_alternative_pct": 100.0,
          "sensitivity_reference_pct": 94.1,
          "relative_trueness_pct": 97.0,
          "false_positive_ratio_alternative_pct": 0.0
        },
        {
          "category": "Dairy products",
          "sensitivity_alternative_pct": 97.0,
          "sensitivity_reference_pct": 100.0,
          "relative_trueness_pct": 98.7,
          "false_positive_ratio_alternative_pct": 0.0
        },
        {
          "category": "Seafood products",
          "sensitivity_alternative_pct": 100.0,
          "sensitivity_reference_pct": 100.0,
          "relative_trueness_pct": 100.0,
          "false_positive_ratio_alternative_pct": 0.0
        },
        {
          "category": "Vegetal products",
          "sensitivity_alternative_pct": 100.0,
          "sensitivity_reference_pct": 100.0,
          "relative_trueness_pct": 100.0,
          "false_positive_ratio_alternative_pct": 0.0
        },
        {
          "category": "Composite foods",
          "sensitivity_alternative_pct": 96.8,
          "sensitivity_reference_pct": 100.0,
          "relative_trueness_pct": 98.4,
          "false_positive_ratio_alternative_pct": 0.0
        },
        {
          "category": "Environmental samples",
          "sensitivity_alternative_pct": 100.0,
          "sensitivity_reference_pct": 100.0,
          "relative_trueness_pct": 100.0,
          "false_positive_ratio_alternative_pct": 0.0
        }
      ],
      "inclusivity": {},
      "exclusivity": {}
    }
  },
  "traceability": {
    "source_document_type": "live_web_page",
    "source_document_url": "https://nf-validation.afnor.org/domaine-agroalimentaire/listeria-monocytogenes/",
    "extraction_date": null,
    "extraction_confidence": "high",
    "notes": "Mined from the summary validation report PDF. relative_trueness_by_category (quantitative) and method_comparison_by_category (qualitative) are extracted from the report's per-category results table via its structural cell grid (pdfplumber), not by matching the table header's exact wording -- confirmed necessary since real reports from different expert laboratories phrase that header differently. accuracy_profile.by_matrix names each matrix by its ISO 16140-2 food CATEGORY (e.g. 'Dairy products'), not the specific product tested (e.g. 'Milk') -- an earlier version tried the more specific product name from the accuracy-profile chart captions, but checking a rendered page image against the extracted text showed that caption sequence can be reordered relative to the SD-repeatability table sequence even on the same page (a chart is a separate drawn object from its table), which silently mispaired two matrices. Category order was checked the same way and does hold, so that's the safe anchor used instead; the extractor refuses to pair values at all (returns []) if the category count and SD-repeatability-line count disagree. samples_out_of_beta_eti is left empty for every matrix: the outside-the-limit narrative names specific products, and mapping those back to the right category isn't safely extractable, so leaving it empty beats a guessed attribution -- see the report itself for that detail. loq_log is NOT mined -- its source table's cell values did not extract as real numbers at all (came back as literal zeros), a clear sign the table structure defeats plain-text extraction; left null rather than record that placeholder. Inclusivity/exclusivity narrative parsing has only been tested against one report (TEMPO EB) and its exact wording -- other reports may need pattern adjustments. Performance data extracted by claude-sonnet-5 reading the PDF directly (native document input), used as a fallback because the deterministic pdfplumber pipeline (summary_report_parser.py) found no per-category breakdown in this report. Model's own extraction notes: This report is a renewal/extension covering two studies: (1) the primary/general \"method comparison study\" (Table 6/7, 394 samples across 6 categories: Meat, Dairy, Seafood, Vegetal, Composite foods, Environmental samples) - recorded above as the canonical study; and (2) a \"specific protocol\" extension study (255 samples, categories: Meat, Dairy, Seafood, Environmental samples only) reported in two variants (1.0 mL transfer protocol - Table 16, and 0.1 mL transfer protocol - Table 17), with all-categories summary values: 1.0ml protocol SEalt=90.1%, SEref=87.6%, RT=89.5%, FPR=0.6%; 0.1ml protocol SEalt=90.0%, SEref=88.3%, RT=89.9%, FPR=0.6%. These specific-protocol per-category values were not recorded in the main table per instructions (only primary study categories recorded). No explicit \"Acceptability Limit\" in log units applies since this is qualitative; instead RLOD acceptability limits of 1.5 (general protocol) and 2.5 (specific protocol, unpaired study) were used for LOD comparisons, not relative trueness.",
    "certificate_pdf_url": "https://nf-validation.afnor.org/wp-content/uploads/2026/09/BIO-12-11-03-04_fr.docx_.pdf",
    "summary_report_pdf_url": "https://nf-validation.afnor.org/wp-content/uploads/2024/03/VIDAS_LMO2_37_2024_03_SR_v0-protected.pdf",
    "organism_page_last_updated_raw": "21 septembre 2026"
  }
}